{
  "$schema": "http://json-schema.org/draft-07/schema#",
  "$id": "https://lucida.local/schemas/visual-pattern.schema.json",
  "title": "Lucida Visual Pattern v1",
  "description": "Canonical visual pattern contract for Style RAG Phase 1.",
  "$comment": "Collection validators must resolve packageId, variantIds, and sourceEvidenceIds; enforce unique patternId and source IDs across canonical collections; require approved evidence; and verify renderer and package consistency before retrieval.",
  "type": "object",
  "additionalProperties": false,
  "required": [
    "schemaVersion",
    "patternId",
    "packageId",
    "variantIds",
    "patternType",
    "intentTags",
    "beatRoles",
    "contentDensity",
    "aspectRatios",
    "layoutTraits",
    "typographyTraits",
    "paletteTraits",
    "motionTraits",
    "componentTraits",
    "contentCapacity",
    "positiveUseCases",
    "antiPatterns",
    "sourceEvidenceIds",
    "classificationReasons",
    "classifierVersion",
    "reviewStatus"
  ],
  "definitions": {
    "slug": {
      "type": "string",
      "pattern": "^[a-z0-9][a-z0-9-]*$"
    },
    "nonEmptyString": {
      "type": "string",
      "minLength": 1
    },
    "uniqueStringList": {
      "type": "array",
      "minItems": 1,
      "uniqueItems": true,
      "items": {
        "$ref": "#/definitions/nonEmptyString"
      }
    },
    "aspectRatioList": {
      "type": "array",
      "minItems": 1,
      "uniqueItems": true,
      "items": {
        "type": "string",
        "enum": ["9:16", "16:9", "1:1"]
      }
    },
    "contentCapacity": {
      "type": "object",
      "minProperties": 1,
      "additionalProperties": false,
      "properties": {
        "headlineChars": { "type": "integer", "minimum": 0 },
        "bodyChars": { "type": "integer", "minimum": 0 },
        "bulletsMaxItems": { "type": "integer", "minimum": 0 },
        "maxDataSeries": { "type": "integer", "minimum": 0 },
        "maxCodeLines": { "type": "integer", "minimum": 0 },
        "maxItems": { "type": "integer", "minimum": 0 },
        "maxPanels": { "type": "integer", "minimum": 0 },
        "maxMetrics": { "type": "integer", "minimum": 0 },
        "maxEvents": { "type": "integer", "minimum": 0 }
      }
    }
  },
  "properties": {
    "schemaVersion": { "const": "lucida-visual-pattern/v1" },
    "patternId": { "$ref": "#/definitions/slug" },
    "packageId": { "$ref": "#/definitions/slug" },
    "variantIds": {
      "type": "array",
      "minItems": 1,
      "uniqueItems": true,
      "items": { "$ref": "#/definitions/slug" }
    },
    "patternType": {
      "enum": [
        "layout",
        "typography",
        "palette",
        "motion",
        "component",
        "composition",
        "content-density",
        "use-case",
        "anti-pattern"
      ]
    },
    "intentTags": { "$ref": "#/definitions/uniqueStringList" },
    "beatRoles": { "$ref": "#/definitions/uniqueStringList" },
    "contentDensity": { "enum": ["sparse", "balanced", "dense"] },
    "aspectRatios": { "$ref": "#/definitions/aspectRatioList" },
    "layoutTraits": { "$ref": "#/definitions/uniqueStringList" },
    "typographyTraits": { "$ref": "#/definitions/uniqueStringList" },
    "paletteTraits": { "$ref": "#/definitions/uniqueStringList" },
    "motionTraits": { "$ref": "#/definitions/uniqueStringList" },
    "componentTraits": { "$ref": "#/definitions/uniqueStringList" },
    "contentCapacity": { "$ref": "#/definitions/contentCapacity" },
    "positiveUseCases": { "$ref": "#/definitions/uniqueStringList" },
    "antiPatterns": { "$ref": "#/definitions/uniqueStringList" },
    "sourceEvidenceIds": {
      "type": "array",
      "minItems": 1,
      "uniqueItems": true,
      "items": { "$ref": "#/definitions/slug" }
    },
    "classificationReasons": { "$ref": "#/definitions/uniqueStringList" },
    "classifierVersion": { "type": "string", "minLength": 1 },
    "reviewStatus": { "enum": ["proposed", "approved", "rejected"] }
  }
}
