[
  {
    "schemaVersion": "lucida-visual-pattern/v1",
    "patternId": "td-chronology-four-record-spine",
    "packageId": "timeline-documentary",
    "variantIds": [
      "chronology"
    ],
    "patternType": "layout",
    "intentTags": [
      "process",
      "case-study"
    ],
    "beatRoles": [
      "explain"
    ],
    "contentDensity": "balanced",
    "aspectRatios": [
      "9:16"
    ],
    "layoutTraits": [
      "dated-spine",
      "alternating-origin-records",
      "four-record-field"
    ],
    "typographyTraits": [
      "serif-record-headlines",
      "mono-date-labels",
      "persistent-source-captions"
    ],
    "paletteTraits": [
      "archival-paper-contrast",
      "amber-evidence-accent"
    ],
    "motionTraits": [
      "chronology-reveal",
      "reduced-motion-compatible"
    ],
    "componentTraits": [
      "dated-spine",
      "archival-frame",
      "source-label",
      "missing-image-record"
    ],
    "contentCapacity": {
      "headlineChars": 64,
      "bodyChars": 280,
      "maxItems": 4,
      "maxPanels": 4,
      "maxEvents": 4
    },
    "positiveUseCases": [
      "render four sourced origin records in ascending date order with a source label on every record"
    ],
    "antiPatterns": [
      "undated origin claims",
      "more than four full-detail origin records"
    ],
    "sourceEvidenceIds": [
      "w8-timeline-citizen-dj"
    ],
    "classificationReasons": [
      "Concrete chronology recipe preserves the deterministic local fixture and verified source evidence; it remains proposed pending human review."
    ],
    "classifierVersion": "terra-pattern-proposal-p8/1.0",
    "reviewStatus": "proposed"
  },
  {
    "schemaVersion": "lucida-visual-pattern/v1",
    "patternId": "td-chronology-date-record-source-type",
    "packageId": "timeline-documentary",
    "variantIds": [
      "chronology"
    ],
    "patternType": "typography",
    "intentTags": [
      "process",
      "case-study"
    ],
    "beatRoles": [
      "explain"
    ],
    "contentDensity": "balanced",
    "aspectRatios": [
      "9:16"
    ],
    "layoutTraits": [
      "dated-spine",
      "fixed-record-metadata-zone"
    ],
    "typographyTraits": [
      "mono-date-labels",
      "serif-record-headlines",
      "compact-source-captions"
    ],
    "paletteTraits": [
      "archival-paper-contrast",
      "amber-evidence-accent"
    ],
    "motionTraits": [
      "metadata-static-content-reveal",
      "reduced-motion-static"
    ],
    "componentTraits": [
      "dated-spine",
      "source-label",
      "archival-frame"
    ],
    "contentCapacity": {
      "headlineChars": 54,
      "bodyChars": 160,
      "maxItems": 4,
      "maxPanels": 4,
      "maxEvents": 4
    },
    "positiveUseCases": [
      "render date, event title, and catalog label as three fixed text roles on each origin record"
    ],
    "antiPatterns": [
      "source text styled as decorative footer copy",
      "event dates detached from their records"
    ],
    "sourceEvidenceIds": [
      "w8-timeline-loc-pictures"
    ],
    "classificationReasons": [
      "Concrete chronology recipe preserves the deterministic local fixture and verified source evidence; it remains proposed pending human review."
    ],
    "classifierVersion": "terra-pattern-proposal-p8/1.0",
    "reviewStatus": "proposed"
  },
  {
    "schemaVersion": "lucida-visual-pattern/v1",
    "patternId": "td-chronology-spine-first-reveal",
    "packageId": "timeline-documentary",
    "variantIds": [
      "chronology"
    ],
    "patternType": "motion",
    "intentTags": [
      "process"
    ],
    "beatRoles": [
      "explain"
    ],
    "contentDensity": "balanced",
    "aspectRatios": [
      "9:16"
    ],
    "layoutTraits": [
      "dated-spine",
      "stable-event-slots"
    ],
    "typographyTraits": [
      "mono-date-labels",
      "serif-record-headlines"
    ],
    "paletteTraits": [
      "archival-paper-contrast",
      "amber-evidence-accent"
    ],
    "motionTraits": [
      "spine-draw-before-records",
      "ordered-record-fade",
      "reduced-motion-static"
    ],
    "componentTraits": [
      "dated-spine",
      "archival-frame",
      "source-label"
    ],
    "contentCapacity": {
      "maxItems": 4,
      "maxPanels": 4,
      "maxEvents": 4
    },
    "positiveUseCases": [
      "reveal a fixed four-event origin sequence without changing chronological order or record geometry"
    ],
    "antiPatterns": [
      "records reordering during motion",
      "continuous decorative motion after the sequence settles"
    ],
    "sourceEvidenceIds": [
      "w8-timeline-citizen-dj"
    ],
    "classificationReasons": [
      "Concrete chronology recipe preserves the deterministic local fixture and verified source evidence; it remains proposed pending human review."
    ],
    "classifierVersion": "terra-pattern-proposal-p8/1.0",
    "reviewStatus": "proposed"
  },
  {
    "schemaVersion": "lucida-visual-pattern/v1",
    "patternId": "td-chronology-catalog-label-component",
    "packageId": "timeline-documentary",
    "variantIds": [
      "chronology"
    ],
    "patternType": "component",
    "intentTags": [
      "process",
      "evidence"
    ],
    "beatRoles": [
      "explain"
    ],
    "contentDensity": "balanced",
    "aspectRatios": [
      "9:16"
    ],
    "layoutTraits": [
      "alternating-origin-records",
      "fixed-record-metadata-zone"
    ],
    "typographyTraits": [
      "compact-source-captions",
      "mono-date-labels"
    ],
    "paletteTraits": [
      "archival-paper-contrast",
      "amber-evidence-accent"
    ],
    "motionTraits": [
      "source-label-enter-with-record",
      "reduced-motion-static"
    ],
    "componentTraits": [
      "source-label",
      "catalog-identifier",
      "archival-frame"
    ],
    "contentCapacity": {
      "bodyChars": 92,
      "maxItems": 4,
      "maxPanels": 4,
      "maxEvents": 4
    },
    "positiveUseCases": [
      "attach one source type and catalog identifier to each dated origin event"
    ],
    "antiPatterns": [
      "source label shared by multiple unrelated records",
      "unlabelled archival frames"
    ],
    "sourceEvidenceIds": [
      "w8-timeline-loc-pictures"
    ],
    "classificationReasons": [
      "Concrete chronology recipe preserves the deterministic local fixture and verified source evidence; it remains proposed pending human review."
    ],
    "classifierVersion": "terra-pattern-proposal-p8/1.0",
    "reviewStatus": "proposed"
  },
  {
    "schemaVersion": "lucida-visual-pattern/v1",
    "patternId": "td-chronology-evidence-to-finding-footer",
    "packageId": "timeline-documentary",
    "variantIds": [
      "chronology"
    ],
    "patternType": "composition",
    "intentTags": [
      "case-study",
      "takeaway"
    ],
    "beatRoles": [
      "explain",
      "takeaway"
    ],
    "contentDensity": "balanced",
    "aspectRatios": [
      "9:16"
    ],
    "layoutTraits": [
      "dated-spine",
      "alternating-origin-records",
      "thesis-footer"
    ],
    "typographyTraits": [
      "serif-record-headlines",
      "compact-finding-copy",
      "persistent-source-captions"
    ],
    "paletteTraits": [
      "archival-paper-contrast",
      "amber-evidence-accent"
    ],
    "motionTraits": [
      "records-settle-then-finding-fade",
      "reduced-motion-static"
    ],
    "componentTraits": [
      "dated-spine",
      "source-label",
      "documentary-thesis"
    ],
    "contentCapacity": {
      "headlineChars": 58,
      "bodyChars": 108,
      "maxItems": 4,
      "maxPanels": 5,
      "maxEvents": 4
    },
    "positiveUseCases": [
      "close four visible dated records with one explicitly interpretive documentary finding"
    ],
    "antiPatterns": [
      "finding that replaces record labels",
      "multiple unsupported conclusions"
    ],
    "sourceEvidenceIds": [
      "w8-timeline-national-archives"
    ],
    "classificationReasons": [
      "Concrete chronology recipe preserves the deterministic local fixture and verified source evidence; it remains proposed pending human review."
    ],
    "classifierVersion": "terra-pattern-proposal-p8/1.0",
    "reviewStatus": "proposed"
  },
  {
    "schemaVersion": "lucida-visual-pattern/v1",
    "patternId": "td-chronology-four-record-density-budget",
    "packageId": "timeline-documentary",
    "variantIds": [
      "chronology"
    ],
    "patternType": "content-density",
    "intentTags": [
      "process"
    ],
    "beatRoles": [
      "explain"
    ],
    "contentDensity": "balanced",
    "aspectRatios": [
      "9:16"
    ],
    "layoutTraits": [
      "dated-spine",
      "four-record-field",
      "alternating-origin-records"
    ],
    "typographyTraits": [
      "serif-record-headlines",
      "compact-source-captions"
    ],
    "paletteTraits": [
      "archival-paper-contrast",
      "amber-evidence-accent"
    ],
    "motionTraits": [
      "one-record-per-beat",
      "reduced-motion-static"
    ],
    "componentTraits": [
      "dated-spine",
      "archival-frame",
      "source-label"
    ],
    "contentCapacity": {
      "headlineChars": 64,
      "bodyChars": 280,
      "maxItems": 4,
      "maxPanels": 4,
      "maxEvents": 4
    },
    "positiveUseCases": [
      "keep an origin chronology inspectable within one portrait frame"
    ],
    "antiPatterns": [
      "five or more full-detail origin records",
      "source captions removed to fit copy"
    ],
    "sourceEvidenceIds": [
      "w8-timeline-citizen-dj"
    ],
    "classificationReasons": [
      "Concrete chronology recipe preserves the deterministic local fixture and verified source evidence; it remains proposed pending human review."
    ],
    "classifierVersion": "terra-pattern-proposal-p8/1.0",
    "reviewStatus": "proposed"
  },
  {
    "schemaVersion": "lucida-visual-pattern/v1",
    "patternId": "td-case-study-decision-marker-spine",